{
  "$schema": "https://json-schema.org/draft/2020-12/schema",
  "$id": "https://example.local/schemas/task_boundary.schema.json",
  "title": "Task Boundary Hook Payload",
  "type": "object",
  "additionalProperties": false,
  "required": [
    "event",
    "action",
    "task",
    "context"
  ],
  "properties": {
    "event": {
      "const": "task_boundary"
    },
    "action": {
      "type": "string",
      "enum": [
        "created",
        "updated"
      ]
    },
    "task": {
      "type": "object",
      "additionalProperties": false,
      "required": [
        "id",
        "title",
        "description",
        "status"
      ],
      "properties": {
        "id": {
          "type": "string",
          "minLength": 1
        },
        "title": {
          "type": "string",
          "minLength": 1
        },
        "description": {
          "type": "string",
          "minLength": 1
        },
        "acceptance_criteria": {
          "type": "array",
          "items": {
            "type": "string",
            "minLength": 1
          }
        },
        "status": {
          "type": "string",
          "enum": [
            "todo",
            "in_progress",
            "blocked"
          ]
        },
        "priority": {
          "type": "string",
          "enum": [
            "low",
            "medium",
            "high"
          ]
        },
        "labels": {
          "type": "array",
          "items": {
            "type": "string",
            "minLength": 1
          }
        },
        "files": {
          "type": "array",
          "items": {
            "type": "string",
            "minLength": 1
          }
        },
        "links": {
          "type": "object",
          "additionalProperties": false,
          "properties": {
            "task_file": {
              "type": "string",
              "minLength": 1
            },
            "repo": {
              "type": "string",
              "minLength": 1
            }
          }
        }
      }
    },
    "context": {
      "type": "object",
      "additionalProperties": false,
      "required": [
        "repo_name",
        "timestamp"
      ],
      "properties": {
        "repo_name": {
          "type": "string",
          "minLength": 1
        },
        "branch": {
          "type": "string",
          "minLength": 1
        },
        "user": {
          "type": "string",
          "minLength": 1
        },
        "timestamp": {
          "type": "string",
          "format": "date-time"
        },
        "session_id": {
          "type": "string",
          "minLength": 1
        }
      }
    }
  }
}
